{
  "$schema": "../../web/schema.json",
  "domainName": "Warehouse Robotics & AMR Logistics",
  "version": "1.0.0",
  "stateSpace": {
    "dimensions": [
      { "name": "X_coord_m", "unit": "m", "range": [0, 50] },
      { "name": "Y_coord_m", "unit": "m", "range": [0, 50] },
      { "name": "Elevation_m", "unit": "m", "range": [0, 10] },
      { "name": "Battery_pct", "unit": "%", "range": [0, 100] },
      { "name": "Payload_kg", "unit": "kg", "range": [0, 200] }
    ]
  },
  "initialState": 0,
  "goalState": 6,
  "badStates": [3],
  "states": [
    { "id": 0, "embedding": [1.0, 4.0, 0.0, 95.0, 50.0], "name": "Inbound_Loading_Dock_AMR01" },
    { "id": 1, "embedding": [3.0, 2.0, 0.0, 88.0, 50.0], "name": "Aisle_A_Narrow_Corridor" },
    { "id": 2, "embedding": [3.0, 6.0, 0.0, 85.0, 50.0], "name": "Aisle_B_Overhead_Conveyor_Deck" },
    { "id": 3, "embedding": [5.0, 2.0, 0.0, 75.0, 50.0], "name": "Heavy_Forklift_Crossway_Hazard" },
    { "id": 4, "embedding": [5.0, 6.0, 1.5, 78.0, 50.0], "name": "Automated_Storage_ASRS_Elevator" },
    { "id": 5, "embedding": [7.0, 4.0, 0.0, 70.0, 50.0], "name": "Sorting_Matrix_Junction" },
    { "id": 6, "embedding": [8.5, 4.0, 0.0, 65.0, 0.0], "name": "Outbound_Dispatch_Bay_Goal" }
  ],
  "transitions": [
    { "id": 101, "from": 0, "to": 1, "cost": 3.0, "safety": 0.95, "reliability": 0.990, "available": true, "name": "Transit_Aisle_A" },
    { "id": 102, "from": 0, "to": 2, "cost": 4.0, "safety": 1.00, "reliability": 0.999, "available": true, "name": "Transit_Aisle_B_Ramp" },
    { "id": 103, "from": 1, "to": 3, "cost": 2.5, "safety": 0.10, "reliability": 0.700, "available": true, "name": "Direct_Crossway_Unprotected" },
    { "id": 104, "from": 1, "to": 4, "cost": 6.0, "safety": 0.98, "reliability": 0.990, "available": true, "name": "Bypass_via_Elevator" },
    { "id": 105, "from": 2, "to": 4, "cost": 3.5, "safety": 1.00, "reliability": 0.999, "available": true, "name": "ASRS_Elevated_Traverse" },
    { "id": 106, "from": 3, "to": 5, "cost": 3.0, "safety": 0.15, "reliability": 0.750, "available": true, "name": "Crossway_Exit" },
    { "id": 107, "from": 4, "to": 5, "cost": 4.0, "safety": 1.00, "reliability": 0.999, "available": true, "name": "Descent_to_Sorting_Junction" },
    { "id": 108, "from": 5, "to": 6, "cost": 2.0, "safety": 1.00, "reliability": 1.000, "available": true, "name": "Final_Docking_Deliver" }
  ]
}
