{
  "$schema": "../../web/schema.json",
  "domainName": "Banking KYC & Loan Underwriting",
  "version": "1.0.0",
  "stateSpace": {
    "dimensions": [
      { "name": "CreditScore_Norm", "unit": "0-10", "range": [0, 10] },
      { "name": "AMLRisk_Index", "unit": "index", "range": [0, 1] },
      { "name": "Collateral_Ratio", "unit": "ratio", "range": [0, 2] },
      { "name": "KYC_Level", "unit": "tier", "range": [1, 5] },
      { "name": "Compliance_Score", "unit": "score", "range": [0, 100] }
    ]
  },
  "initialState": 0,
  "goalState": 6,
  "badStates": [3],
  "states": [
    { "id": 0, "embedding": [1.0, 4.0, 0.05, 1.0, 95.0], "name": "Application_Submission_Intake" },
    { "id": 1, "embedding": [3.0, 2.0, 0.10, 3.0, 90.0], "name": "Automated_Identity_Verification" },
    { "id": 2, "embedding": [3.0, 6.0, 0.02, 4.0, 98.0], "name": "Institutional_Credit_Bureau_Check" },
    { "id": 3, "embedding": [5.0, 2.0, 0.95, 1.0, 10.0], "name": "Sanctioned_Entity_AML_Hit_Hazard" },
    { "id": 4, "embedding": [5.0, 6.0, 0.05, 5.0, 99.0], "name": "Senior_Risk_Underwriter_Audit" },
    { "id": 5, "embedding": [7.0, 4.0, 0.01, 5.0, 100.0], "name": "Escrow_Lien_Perfection" },
    { "id": 6, "embedding": [8.5, 4.0, 0.00, 5.0, 100.0], "name": "Loan_Disbursement_Complete_Goal" }
  ],
  "transitions": [
    { "id": 101, "from": 0, "to": 1, "cost": 10.0, "safety": 0.98, "reliability": 0.990, "available": true, "name": "POST /kyc/automated_verify" },
    { "id": 102, "from": 0, "to": 2, "cost": 25.0, "safety": 1.00, "reliability": 0.999, "available": true, "name": "POST /credit/equifax_prime" },
    { "id": 103, "from": 1, "to": 3, "cost": 5.0, "safety": 0.05, "reliability": 0.500, "available": true, "name": "POST /screening/fast_pass_unverified" },
    { "id": 104, "from": 1, "to": 4, "cost": 35.0, "safety": 0.99, "reliability": 0.995, "available": true, "name": "POST /underwriting/manual_escalation" },
    { "id": 105, "from": 2, "to": 4, "cost": 15.0, "safety": 1.00, "reliability": 0.999, "available": true, "name": "POST /underwriting/tier1_review" },
    { "id": 106, "from": 3, "to": 5, "cost": 50.0, "safety": 0.10, "reliability": 0.600, "available": true, "name": "POST /escrow/risky_bypass" },
    { "id": 107, "from": 4, "to": 5, "cost": 20.0, "safety": 1.00, "reliability": 0.999, "available": true, "name": "POST /escrow/collateral_pledge" },
    { "id": 108, "from": 5, "to": 6, "cost": 8.0, "safety": 1.00, "reliability": 1.000, "available": true, "name": "POST /wire/fedwire_disburse" }
  ]
}
